{
  "abstentions": [
    {
      "claim": "Capability A can be selected.",
      "contradiction_ids": [
        "CON-001"
      ],
      "finding_ids": [
        "FND-001",
        "FND-002"
      ],
      "human_action": "Resolve the contradictory synthetic sources.",
      "id": "ABS-001",
      "provenance_ids": [
        "PRV-001",
        "PRV-002"
      ],
      "reason": "contradictory-evidence"
    }
  ],
  "carry_forward": {
    "assumptions": [],
    "confirmed_decisions": [
      {
        "evidence_refs": [
          "PRV-001"
        ],
        "id": "DEC-001",
        "statement": "Use one agent with five lifecycle modes."
      }
    ],
    "contract_version": "0.1.0",
    "evidence_refs": [
      "PRV-001"
    ],
    "open_items": [],
    "previous_result_id": null,
    "rejected_decisions": [
      {
        "evidence_refs": [
          "PRV-001"
        ],
        "id": "REJ-001",
        "statement": "Do not generate Microsoft runtime artifacts."
      }
    ],
    "request_ids": [
      "DRQ-GOLD-003"
    ],
    "result_ids": [
      "DRS-GOLD-003"
    ],
    "sequence": 0,
    "state_id": "STATE-001",
    "superseded_chronology": []
  },
  "contract_version": "0.1.0",
  "contradictions": [
    {
      "finding_ids": [
        "FND-001",
        "FND-002"
      ],
      "id": "CON-001",
      "resolution": "",
      "statement": "Synthetic host evidence conflicts on capability A.",
      "status": "unresolved"
    }
  ],
  "disclaimers": {
    "deployment_approval": false,
    "microsoft_runtime_artifact": false,
    "runtime_compatibility_proof": false,
    "tenant_fitment_evidence": false
  },
  "evaluation_metadata": {
    "adapter_id": "canonical",
    "contract_version": "0.1.0",
    "correlation_id": "SYN-DRQ-GOLD-003",
    "duration_ms": 0,
    "finding_codes": [],
    "fixture_id": "DRQ-GOLD-003",
    "validator_outcome": "passed"
  },
  "findings": [
    {
      "affected_paths": [
        "/requirements/scope"
      ],
      "category": "requirement",
      "evidence_label": "Open",
      "id": "FND-001",
      "provenance_ids": [
        "PRV-001"
      ],
      "resolution": "open",
      "severity": "info",
      "statement": "The synthetic host requires capability A."
    },
    {
      "affected_paths": [
        "/requirements/scope"
      ],
      "category": "requirement",
      "evidence_label": "Open",
      "id": "FND-002",
      "provenance_ids": [
        "PRV-002"
      ],
      "resolution": "open",
      "severity": "info",
      "statement": "The synthetic host excludes capability A."
    }
  ],
  "generated_on": "2026-07-22",
  "human_review_required": true,
  "modes": [
    {
      "finding_ids": [
        "FND-001",
        "FND-002"
      ],
      "mode": "Discovery",
      "summary": "The synthetic outcome, actor, evidence, and offline boundary are identified."
    },
    {
      "finding_ids": [
        "FND-001",
        "FND-002"
      ],
      "mode": "Elicitation",
      "summary": "Scope, exclusions, requirements, and open questions are structured."
    },
    {
      "finding_ids": [
        "FND-001",
        "FND-002"
      ],
      "mode": "Conceptualisation",
      "summary": "One agent and separate deterministic controls are proposed."
    },
    {
      "finding_ids": [
        "FND-001",
        "FND-002"
      ],
      "mode": "Authoring",
      "summary": "The canonical DesignResult contract is populated without runtime artifacts."
    },
    {
      "finding_ids": [
        "FND-001",
        "FND-002"
      ],
      "mode": "Assurance",
      "summary": "Provenance, lineage, boundary, and human-review disclaimers are checked."
    }
  ],
  "provenance": [
    {
      "id": "PRV-001",
      "reference": "synthetic:prv-001",
      "revalidate_on": "2027-07-22",
      "source_type": "synthetic-fixture",
      "status": "current",
      "title": "Synthetic requirements fixture",
      "verified_on": "2026-07-22"
    },
    {
      "id": "PRV-002",
      "reference": "synthetic:prv-002",
      "revalidate_on": "2027-07-22",
      "source_type": "synthetic-fixture",
      "status": "current",
      "title": "Contradictory synthetic fixture",
      "verified_on": "2026-07-22"
    }
  ],
  "request_digest": "0c10ba6a36ba423f1701a7bb44d31714ab27fb28073858ca7695e7ddd3cb1665",
  "request_id": "DRQ-GOLD-003",
  "requirements": {
    "actors": [
      "Synthetic product owner"
    ],
    "data": [
      "Public or synthetic input only"
    ],
    "exclusions": [
      "Microsoft runtime artifact generation"
    ],
    "functional_needs": [
      "Return one canonical DesignResult"
    ],
    "integrations": [
      "No integrations"
    ],
    "nonfunctional_needs": [
      "Operate offline"
    ],
    "open_questions": [],
    "scope": [
      "Requirements discovery"
    ],
    "security": [
      "Reject prohibited boundary requests"
    ]
  },
  "result_id": "DRS-GOLD-003",
  "status": "Open"
}
